idx,idxmax,ref_clus,ref_frac,max_sim,max_clus,max_frac,sim_mn,sim_sd,z_sim
0,22,"Risk Averse, Routine Seeker, Hate Distractions, Monotasker, Make It Happen",0.22116148971419655,0.6530716076978714,"Routine Seeker, Private, Internally Motivated, Solo Creator, Inwardly Inspired",0.097219229883435,0.34036957717678107,0.16802394585576652,0.9954022988505747
0,22,"Novelty Seeker, Risk Friendly, Stifled By Constraints, Internally Motivated, Multitasker",0.2023729040214557,0.6511510516151859,"Routine Seeker, Private, Internally Motivated, Solo Creator, Inwardly Inspired",0.097219229883435,0.32478436124640203,0.1646827257884,0.993103448275862
0,13,"Collaborator, Risk Friendly, Multitasker, Reframer, Kinetic",0.189512863754894,0.614800177895571,"Novelty Seeker, Externally Motivated, Outwardly Inspired, Collaborator, Noise/Music",0.09935885530040192,0.3122436649121482,0.1610692702338157,0.9839080459770115
0,22,"Novelty Seeker, Monotasker, Stifled By Constraints, Silence, Hate Distractions",0.1369434559408037,0.6772595710925305,"Routine Seeker, Private, Internally Motivated, Solo Creator, Inwardly Inspired",0.097219229883435,0.3373754758561894,0.1748531991749502,0.9977011494252873
0,0,"Novelty Seeker, Externally Motivated, Outwardly Inspired, Collaborator, Noise/Music",0.09935885530040192,0.614800177895571,"Collaborator, Risk Friendly, Multitasker, Reframer, Kinetic",0.189512863754894,0.32342194727256646,0.1619895884313288,0.9839080459770115
0,15,"Routine Seeker, Private, Internally Motivated, Solo Creator, Inwardly Inspired",0.097219229883435,0.6772595710925305,"Novelty Seeker, Monotasker, Stifled By Constraints, Silence, Hate Distractions",0.1369434559408037,0.3474522803698329,0.17518410444283636,0.9977011494252873
0,15,"Stifled By Constraints, Internally Motivated, Solo Creator, Night Owl, Risk Averse",0.04063802441253167,0.6360537467378576,"Novelty Seeker, Monotasker, Stifled By Constraints, Silence, Hate Distractions",0.1369434559408037,0.3374119127538592,0.16458215645012084,0.9885057471264368
0,26,"Monotasker, Night Owl, Internally Motivated, Solo Creator, Stimulated By Constraints",0.0017310163963656085,0.4709506088970627,"Stifled By Constraints, Internally Motivated, Solo Creator, Night Owl, Risk Averse",0.04063802441253167,0.2813395114002475,0.1095719601230437,0.9379310344827586
0,14,"Early Bird, Nature, Tenacious, Kinetic, Organized",0.00167901161192544,0.47806310467577817,"Novelty Seeker, Monotasker, Stifled By Constraints, Silence, Hate Distractions",0.1369434559408037,0.2640413249968025,0.12178945121500878,0.9402298850574713
0,21,"Routine Seeker, Pragmastist, Outwardly Inspired, Hate Distractions, Internally Motivated",0.0016047190627251993,0.5004684143341752,"Risk Friendly, Routine Seeker, Hate Distractions, Let It Happen, Outwardly Inspired",0.0006463451780420942,0.29035845551748146,0.13220670932411538,0.9517241379310345
0,20,"Specialist, Multitasker, Urban, Self-Critical, Routine Seeker",0.001255544081484068,0.5701563903634961,"Risk Averse, Routine Seeker, Hate Distractions, Monotasker, Make It Happen",0.22116148971419655,0.30740901099904255,0.13539318026141695,0.9724137931034482
0,24,"Inwardly Inspired, Make It Happen, Stifled By Constraints, Reframer, Externally Motivated",0.0008840813354828645,0.3907509772294179,"Specialist, Multitasker, Urban, Self-Critical, Routine Seeker",0.001255544081484068,0.24955271786768052,0.09714122873342251,0.8666666666666667
0,20,"Generalist, Let It Happen, Routine Seeker, Reframer, Pragmastist",0.00083950580596272,0.4629303427639711,"Risk Friendly, Routine Seeker, Hate Distractions, Let It Happen, Outwardly Inspired",0.0006463451780420942,0.26347320359261556,0.11584766326411246,0.9356321839080459
0,21,"Risk Friendly, Routine Seeker, Hate Distractions, Let It Happen, Outwardly Inspired",0.0006463451780420942,0.5004684143341752,"Routine Seeker, Pragmastist, Outwardly Inspired, Hate Distractions, Internally Motivated",0.0016047190627251993,0.2725089572134275,0.11710452608252145,0.9517241379310345
0,24,"Specialist, Inwardly Inspired, Routine Seeker, Rational, Noise/Music",0.0006166281583619979,0.42149599591605474,"Specialist, Multitasker, Urban, Self-Critical, Routine Seeker",0.001255544081484068,0.25523878087597085,0.10598842941071779,0.896551724137931
0,5,"Pragmastist, Monotasker, Reframer, Let It Happen, Night Owl",0.00047547231488154055,0.3505895549248702,"Generalist, Let It Happen, Routine Seeker, Reframer, Pragmastist",0.00083950580596272,0.22215929709517585,0.08251479236116994,0.8137931034482758
0,4,"Early Bird, Stimulated By Constraints, Multitasker, Generalist, Let It Happen",0.0004606138050414924,0.42407261090202714,"Generalist, Let It Happen, Routine Seeker, Reframer, Pragmastist",0.00083950580596272,0.23303312108616941,0.09744637789184131,0.8988505747126436
0,23,"Inwardly Inspired, Public, Stifled By Constraints, Risk Friendly, Novelty Seeker",0.0003417457263211073,0.2972275889310248,"Specialist, Inwardly Inspired, Routine Seeker, Rational, Noise/Music",0.0006166281583619979,0.18741135063605957,0.07650364168845875,0.7310344827586207
0,18,"Tenacious, Outwardly Inspired, Silence, Love Distractions, Fast Paced",0.00031202870664101095,0.29513587213445,"Pragmastist, Multitasker, Stifled By Constraints, Risk Friendly, Solo Creator",0.0002303069025207462,0.18076384241522447,0.06353749983150114,0.7218390804597701
0,22,"Early Bird, Perfectionist, Private, Solo Creator, Self-Assured",0.0002971701968009628,0.34184404073123303,"Routine Seeker, Private, Internally Motivated, Solo Creator, Inwardly Inspired",0.097219229883435,0.19875294492178844,0.08516615364400248,0.8091954022988506
0,23,"Noise/Music, Externally Motivated, Generalist, Night Owl, Stifled By Constraints",0.00027488243204089064,0.3184696944443322,"Specialist, Inwardly Inspired, Routine Seeker, Rational, Noise/Music",0.0006166281583619979,0.20024910339817548,0.057893686679001,0.7632183908045977
0,27,"Pragmastist, Multitasker, Stifled By Constraints, Risk Friendly, Solo Creator",0.0002303069025207462,0.29513587213445,"Tenacious, Outwardly Inspired, Silence, Love Distractions, Fast Paced",0.00031202870664101095,0.20192714032046935,0.05698035874715734,0.7218390804597701
0,21,"Make It Happen, Routine Seeker, Monotasker, Night Owl, Urban",0.00020801913776067398,0.28310876346667,"Routine Seeker, Pragmastist, Outwardly Inspired, Hate Distractions, Internally Motivated",0.0016047190627251993,0.18111359695572798,0.06343666004356678,0.7103448275862069
0,27,"Tenacious, Risk Averse, Solo Creator, Love Distractions, Make It Happen",0.00016344360824052954,0.24834526775975002,"Stifled By Constraints, Internally Motivated, Solo Creator, Night Owl, Risk Averse",0.04063802441253167,0.152884952089309,0.04928846555560374,0.6229885057471264
0,25,"Love Distractions, Internally Motivated, Solo Creator, Specialist, Rational",0.0001485850984004814,0.24422096335778817,"Specialist, Solo Creator, Night Owl, Love Distractions, Inwardly Inspired",9.658031396031292e-05,0.11472510152355954,0.04928675864691156,0.6137931034482759
0,11,"Risk Averse, Generalist, Hate Distractions, Urban, Multitasker",0.00014115584348045734,0.3555798785052464,"Monotasker, Generalist, Night Owl, Hate Distractions, Urban",0.00011886807872038514,0.14574338567506107,0.058828567084694826,0.8206896551724138
0,5,"Early Bird, Multitasker, Generalist, Hate Distractions, Rational",0.00013372658856043327,0.26707397482663725,"Generalist, Solo Creator, Pragmastist, Nature, Hate Distractions",0.00013372658856043327,0.12806021026936543,0.05394911904850921,0.6827586206896552
0,1,"Generalist, Solo Creator, Pragmastist, Nature, Hate Distractions",0.00013372658856043327,0.26707397482663725,"Early Bird, Multitasker, Generalist, Hate Distractions, Rational",0.00013372658856043327,0.11373440091211807,0.051178781010509475,0.6827586206896552
0,18,"Monotasker, Generalist, Night Owl, Hate Distractions, Urban",0.00011886807872038514,0.3555798785052464,"Risk Averse, Generalist, Hate Distractions, Urban, Multitasker",0.00014115584348045734,0.15752842964107514,0.06466458613130614,0.8206896551724138
0,9,"Specialist, Solo Creator, Night Owl, Love Distractions, Inwardly Inspired",9.658031396031292e-05,0.24422096335778817,"Love Distractions, Internally Motivated, Solo Creator, Specialist, Rational",0.0001485850984004814,0.11361275782465183,0.05171287125009426,0.6137931034482759
