Cluster,Creative_Style,Cluster_Size
Cluster_1,"Externally Motivated, Hate Distractions, Risk Averse, Monotasker, Outwardly Inspired",2195
Cluster_2,"Collaborator, Multitasker, Risk Friendly, Reframer, Outwardly Inspired",2059
Cluster_5,"Risk Friendly, Stifled By Constraints, Multitasker, Novelty Seeker, Internally Motivated",1971
Cluster_0,"Solo Creator, Internally Motivated, Monotasker, Private, Hate Distractions",1772
Cluster_3,"Risk Friendly, Monotasker, Novelty Seeker, Let It Happen, Internally Motivated",746
Cluster_4,"Novelty Seeker, Noise/Music, Risk Averse, Stifled By Constraints, Night Owl",453
Cluster_6,"Multitasker, Make It Happen, Risk Averse, NonKinetic, Routine Seeker",254
